{
  "schemaVersion": "0.1.0",
  "modelId": "bookmark-register-handoff",
  "architectureRef": "bookmark-register-architecture",
  "decisionLogRef": "bookmark-shared-operations-decisions",
  "slices": [
    {
      "id": "implement-bookmark-operations",
      "outcome": "Bookmark writes, queries, exports, and audit coordination use the selected module boundary",
      "status": "ready",
      "elementRefs": ["bookmark-operations"],
      "constraintRefs": ["bookmark-owns-writes", "bookmark-shared-owns-writes"],
      "decisionRefs": ["direct-cli-ownership", "share-bookmark-operations"],
      "blockedByDecisionRefs": [],
      "dependsOnSliceRefs": [],
      "acceptanceChecks": [
        {
          "check": "Run bookmark operation integration tests",
          "expected": "Valid changes commit with audit entries and invalid changes leave no partial state"
        }
      ],
      "migration": "No data migration is required for the new module boundary",
      "rollback": "Revert the module wiring while preserving the existing bookmark records"
    }
  ]
}
